"species","spnumber","star","pref"
"Meliosma myriantha Sieb. et Zucc.",5406,"GN","Yamanashi"
"Vaccinium vitis-idaea L.",4505,"GN","Yamanashi"
"Vitis coignetiae Pulliat ex Planch.",5484,"GN","Yamanashi"
"Pinus koraiensis Sieb. et Zucc.",3984,"GN","Yamanashi"
"Acer argutum Maxim.",5378,"BU","Yamanashi"
"Rubia argyi (L{e'}v. et Van.) Hara ex Lauener",4839,"GN","Yamanashi"
"Ilex rugosa F. Schmidt",5424,"GN","Yamanashi"
"Viburnum erosum Thunb. ex Murray",5217,"GN","Yamanashi"
"Rhododendron japonicum (A. Gray) Suringar",4465,"BU","Yamanashi"
"Ampelopsis glandulosa (Wall.) Momiy. var. hancei",682,"GN","Yamanashi"
"Cryptotaenia japonica Hassk.",5765,"GN","Yamanashi"
"Viburnum furcatum Bl. ex Maxim.",5214,"GN","Yamanashi"
"Hydrangea involucrata Siebold var. involucrata",11206,"BU","Yamanashi"
"Zanthoxylum schinifolium Sieb. et Zucc.",5343,"GN","Yamanashi"
"Pinus pumila (Pall.) Regel",3983,"GN","Yamanashi"
"Akebia trifoliata (Thunb.) Koidz.",10580,"GN","Yamanashi"
"Pterocarya rhoifolia Siebold et Zucc.",9576,"GN","Yamanashi"
"Eupatorium glehni F. Schmidt ex Trautv.",4284,"GN","Yamanashi"
"Zanthoxylum piperitum (L.) DC.",5338,"GN","Yamanashi"
"Vitis ficifolia Bunge var. lobata Regel",675,"GN","Yamanashi"
"Abies veitchii Lindl.",3138,"BU","Yamanashi"
"Fraxinus sieboldiana Bl.",4625,"GN","Yamanashi"
"Imperata cylindrica (L.) Raeusch.",29511,"GN","Yamanashi"
"Larix kaempferi (Lamb.) Carri{e`}re",3975,"BU","Yamanashi"
"Diapensia lapponica L. var. obovata",273,"GN","Yamanashi"
"Hydrangea paniculata Siebold",11209,"GN","Yamanashi"
"Aralia cordata Thunb.",3227,"GN","Yamanashi"
"Buckleya lanceolata (Siebold et Zucc.) Miq.",9889,"GN","Yamanashi"
"Callicarpa japonica Thunb.",4907,"GN","Yamanashi"
"Picrasma quassioides (D. Don) Benn.",5354,"GN","Yamanashi"
"Zelkova serrata (Thunb.) Makino",9762,"GN","Yamanashi"
"Carpinus tschonoskii Maxim.",9712,"GN","Yamanashi"
"Eleutherococcus sciadophylloides (Franch. et Sav.) H. Ohashi",5746,"GN","Yamanashi"
"Juglans mandshurica Maxim. var. sachalinensis (Miyabe et Kud{o^}) Kitam.",9579,"GN","Yamanashi"
"Stephanandra incisa (Thunb.) Siebold et Zucc. ex Zabel var. incisa",11254,"GN","Yamanashi"
"Hovenia dulcis Thunb.",5472,"GN","Yamanashi"
"Fallopia japonica (Houtt.) Ronse Decr. var. japonica",9949,"GN","Yamanashi"
"Impatiens noli-tangere L.",5409,"GN","Yamanashi"
"Drosera rotundifolia L.",10961,"GN","Yamanashi"
"Adiantum pedatum L.",3447,"GN","Yamanashi"
"Plantago asiatica L.",5144,"GN","Yamanashi"
"Aster scaber Thunb.",4175,"GN","Yamanashi"
"Clematis apiifolia DC.",10437,"GN","Yamanashi"
"Abies firma Sieb. et Zucc.",3968,"BU","Yamanashi"
"Senecio cannabifolius Less.",4119,"GN","Yamanashi"
"Picea alcoquiana (Veitch ex Lindl.) Carri{e`}re",3981,"GD","Yamanashi"
"Sophora flavescens Sol.",11598,"GN","Yamanashi"
"Lindera praecox (Siebold et Zucc.) Blume",10282,"BU","Yamanashi"
"Sanicula chinensis Bunge",5760,"GN","Yamanashi"
"Saxifraga fortunei Hook. f. var. alpina (Matsum. et Nakai) Nakai",11092,"GN","Yamanashi"
"Oplopanax japonicus (Nakai) Nakai",5752,"BU","Yamanashi"
"Picea koyamae Shiras.",3980,"BK","Nagano"
"Picea koyamae Shiras.",3980,"BK","Yamanashi"
"Blechnum niponicum (Kunze) Makino",3531,"GN","Yamanashi"
"Phryma leptostachya L. var. oblongifolia Koidz.",499,"GN","Yamanashi"
"Acer micranthum Sieb. et Zucc.",5384,"BU","Yamanashi"
"Arcterica nana (Maxim.) Makino",4494,"GN","Yamanashi"
"Leibnitzia anandria (L.) Turcz.",4392,"GN","Yamanashi"
"Cocculus trilobus (Thunb.) DC.",10592,"GN","Yamanashi"
"Abies mariesii Mast.",3970,"BU","Yamanashi"
"Cassiope lycopodioides (Pall.) D. Don",4493,"GN","Yamanashi"
"Philadelphus satsumi Siebold ex Lindl. et Paxton",11178,"BU","Yamanashi"
"Rubus parvifolius L.",11435,"GN","Yamanashi"
"Gaultheria miqueliana Takeda",4495,"GN","Yamanashi"
"Empetrum nigrum L. var. japonicum",340,"GN","Yamanashi"
"Anaphalis margaritacea (L.) Benth. et Hook. f.",4280,"GN","Yamanashi"
"Lyonia ovalifolia (Wall.) Drude var. elliptica Sieb. et Zucc.",328,"GN","Yamanashi"
"Elliottia paniculata (Sieb. et Zucc.) Benth. et Hook. f.",4411,"GN","Yamanashi"
"Thuja standishii (Gordon) Carri{e`}re",3991,"BU","Yamanashi"
"Aesculus turbinata Blume",5402,"GN","Yamanashi"
"Salix udensis Trautv. et C. A. Mey.",9622,"GN","Yamanashi"
"Parthenocissus tricuspidata (Sieb. et Zucc.) Planch.",5488,"GN","Yamanashi"
"Pedicularis keiskei Fr. et Sav.",5113,"BK","Yamanashi"
"Picea shirasawae Hayashi",3979,"BK","Nagano"
"Picea shirasawae Hayashi",3979,"BK","Yamanashi"
"Betula corylifolia Regel et Maxim",9687,"BU","Yamanashi"
"Acer tschonoskii Maxim.",3180,"BU","Yamanashi"
"Celtis sinensis Pers.",9767,"GN","Yamanashi"
"Arctous alpinus (L.) Nied. var. japonicus Nakai",330,"GN","Yamanashi"
"Acalypha australis L.",5291,"GN","Yamanashi"
"Acer pictum Thunb. subsp. mono Maxim.",648,"GN","Yamanashi"
"Sorbus gracilis (Siebold et Zucc.) K. Koch",11296,"BU","Yamanashi"
"Alnus viridis (Chaix) Lam. et DC. subsp. maximowiczii (Callier ex C.K.Schneid.) H. Ohba",9663,"GN","Yamanashi"
"Schisandra chinensis (Turcz.) Baill.",10256,"GN","Yamanashi"
"Syneilesis palmata (Thunb.) Maxim.",4132,"GN","Yamanashi"
"Aria japonica Decne.",11298,"BU","Yamanashi"
"Phellodendron amurense Rupr.",3178,"GN","Yamanashi"
"Rhododendron aureum Georgi",4474,"GN","Yamanashi"
"Loiseleuria procumbens (L.) Desv.",4413,"GN","Yamanashi"
"Acer ukurunduense Trautv. et C. A. Mey.",5387,"GN","Yamanashi"
"Rhododendron obtusum (Lindl.) Planch. var. kaempferi Planch.",290,"BU","Yamanashi"
"Styrax japonicus Sieb. et Zucc.",4592,"GN","Yamanashi"
"Thalictrum minus L. var. hypoleucum (Siebold et Zucc.) Miq.",10543,"GN","Yamanashi"
"Diphylleia grayi F. Schmidt",10577,"GN","Yamanashi"
"Rhododendron semibarbatum Maxim.",4432,"GN","Yamanashi"
"Silene miqueliana (Rohrb.) H.Ohashi et H.Nakai",10151,"BU","Yamanashi"
"Artemisia pedunculosa Miq.",4214,"GD","Yamanashi"
"Geum calthifolium Sm. var. nipponicum (F.Bolle) Ohwi",11572,"GN","Yamanashi"
"Gaultheria adenothrix (Miq.) Maxim.",4496,"GN","Yamanashi"
"Lonicera japonica Thunb. ex Murray",5231,"GN","Yamanashi"
"Leucothoe grayana Maxim.",4488,"BU","Yamanashi"
"Cladothamnus bracteatus (Maxim.) Yamazaki",4410,"BU","Yamanashi"
"Stellaria aquatica (L.) Scop.",10117,"GN","Yamanashi"
"Alnus matsumurae Callier",9671,"GD","Yamanashi"
"Stellaria nipponica Ohwi var. nipponica",10108,"GD","Yamanashi"
"Osmunda japonica Thunb.",3329,"GN","Yamanashi"
"Phyllodoce aleutica (Spreng.) A. Heller",4415,"GN","Yamanashi"
"Ulmus davidiana Planch. var. japonica (RENDER) Nakai",9760,"GN","Yamanashi"
"Aruncus dioicus (Walter) Fernaid var. kamtschaticus (Maxim.) H. Hara",11247,"GN","Yamanashi"
"Harrimanella stelleriana (Pall.) Coville",4492,"GN","Yamanashi"
"Houttuynia cordata Thunb.",10614,"GN","Yamanashi"
"Hieracium japonicum Franch. et Sav.",4056,"BU","Yamanashi"
"Acer micranthum Sieb. et Zucc.",5384,"BU","Saitama"
"Schisandra repanda (Siebold et Zucc.) Radlk.",10257,"GN","Yamanashi"
"Swertia bimaculata (Sieb. et Zucc.) Hook. f. et Thoms. ex C. B. Clarke",4654,"GN","Saitama"
"Alnus viridis (Chaix) Lam. et DC. subsp. maximowiczii (Callier ex C.K.Schneid.) H. Ohba",9663,"GN","Saitama"
"Ilex rugosa F. Schmidt",5424,"GN","Saitama"
"Betula corylifolia Regel et Maxim",9687,"BU","Saitama"
"Ainsliaea apiculata Sch.-Bip.",3160,"GN","Nagano"
"Ainsliaea apiculata Sch.-Bip.",3160,"GN","Yamanashi"
"Hydrangea petiolaris Siebold et Zucc.",11203,"GN","Saitama"
"Empetrum nigrum L. var. japonicum",340,"GN","Saitama"
"Cassiope lycopodioides (Pall.) D. Don",4493,"GN","Saitama"
"Rhododendron keiskei Miq.",4429,"BU","Yamanashi"
"Vaccinium vitis-idaea L.",4505,"GN","Saitama"
"Actinidia kolomikta (Maxim.",10712,"0.004785","Saitama"
"Arcterica nana (Maxim.) Makino",4494,"GN","Saitama"
"Chamaepericlymenum canadense (L.) Asch. et Graebn.",5737,"GN","Saitama"
"Aster glehni F. Schmidt var. hondoensis",151,"BU","Saitama"
"Actinidia polygama (Siebold et Zucc.) Planch. ex Maxim.",10711,"GN","Yamanashi"
"Tripterospermum japonicum (Sieb. et Zucc.) Maxim.",4682,"GN","Saitama"
"Tripterospermum japonicum (Sieb. et Zucc.) Maxim.",4682,"GN","Yamanashi"
"Clintonia udensis Trautv. & C.A.Mey.",25816,"GN","Saitama"
"Vitis flexuosa Thunb.",3192,"GN","Yamanashi"
"Acer tschonoskii Maxim.",3180,"BU","Saitama"
"Oplopanax japonicus (Nakai) Nakai",5752,"BU","Saitama"
"Acer ukurunduense Trautv. et C. A. Mey.",5387,"GN","Saitama"
"Pieris japonica (Thunb.) D. Don ex G. Don",4489,"BU","Yamanashi"
"Laportea bulbifera (Siebold et Zucc.) Wedd.",9810,"GN","Saitama"
"Acer argutum Maxim.",5378,"BU","Saitama"
"Pedicularis keiskei Fr. et Sav.",5113,"BK","Saitama"
"Pedicularis keiskei Fr. et Sav.",5113,"BK","Gunma"
"Loiseleuria procumbens (L.) Desv.",4413,"GN","Saitama"
"Cladothamnus bracteatus (Maxim.) Yamazaki",4410,"BU","Saitama"
"Salix udensis Trautv. et C. A. Mey.",9622,"GN","Saitama"
"Arctous alpinus (L.) Nied. var. japonicus Nakai",330,"GN","Saitama"
"Fagus japonica Maxim.",9719,"BU","Yamanashi"
"Diapensia lapponica L. var. obovata",273,"GN","Saitama"
"Trientalis europaea L.",4559,"GN","Saitama"
"Trientalis europaea L.",4559,"GN","Yamanashi"
"Leucothoe grayana Maxim.",4488,"BU","Saitama"
"Saxifraga fortunei Hook. f. var. alpina (Matsum. et Nakai) Nakai",11092,"GN","Saitama"
"Geum calthifolium Sm. var. nipponicum (F.Bolle) Ohwi",11572,"GN","Saitama"
"Phyllodoce aleutica (Spreng.) A. Heller",4415,"GN","Saitama"
"Pinus pumila (Pall.) Regel",3983,"GN","Saitama"
"Rhododendron aureum Georgi",4474,"GN","Saitama"
"Chamaecyparis obtusa (Sieb. et Zucc.) Endl.",3992,"BU","Yamanashi"
"Parasenecio delphiniifolia (Sieb. et Zucc.) H. Koyama",4138,"GN","Yamanashi"
"Senecio cannabifolius Less.",4119,"GN","Saitama"
"Cimicifuga simplex (DC.) Turcz",10328,"GN","Saitama"
"Gaultheria adenothrix (Miq.) Maxim.",4496,"GN","Saitama"
"Rosa multiflora Thunb. var. multiflora",11464,"GN","Tokyo"
"Aralia elata (Miq.) Seem.",5738,"GN","Tokyo"
"Acer diabolicum Blume ex K. Koch",5396,"BU","Saitama"
"Acer diabolicum Blume ex K. Koch",5396,"BU","Tokyo"
"Viburnum dilatatum Thunb. ex Murray",5219,"GN","Tokyo"
"Paederia foetida L.",4835,"GN","Tokyo"
"Eupatorium makinoi Kawahara et Yahara var. oppositifolium Koidz.",202,"GN","Tokyo"
"Indigofera pseudotinctoria Matsum.",11687,"GN","Tokyo"
"Schisandra repanda (Siebold et Zucc.) Radlk.",10257,"GN","Tokyo"
"Padus grayana (Maxim.) C.K.Schneid.",11327,"GN","Tokyo"
"Disporum smilacinum A. Gray",29829,"GN","Tokyo"
"Chloranthus japonicus Siebold",10620,"GN","Yamanashi"
"Chloranthus japonicus Siebold",10620,"GN","Tokyo"
"Rhus javanica L.",5372,"GN","Tokyo"
"Rubus microphyllus L.f.",11420,"GN","Tokyo"
"Lyonia ovalifolia (Wall.) Drude var. elliptica Sieb. et Zucc.",328,"GN","Tokyo"
"Tsuga sieboldii Carri{e`}re",3972,"GN","Tokyo"
"Philadelphus satsumi Siebold ex Lindl. et Paxton",11178,"BU","Tokyo"
"Impatiens textorii Miq.",5408,"GN","Tokyo"
"Thuja standishii (Gordon) Carri{e`}re",3991,"BU","Tokyo"
"Hydrangea paniculata Siebold",11209,"GN","Tokyo"
"Deutzia scabra Thunb. var. scabra",11195,"BU","Tokyo"
"Hydrangea petiolaris Siebold et Zucc.",11203,"GN","Tokyo"
"Salix integra Thunb.",9613,"GN","Tokyo"
"Styrax shiraianus Makino",4594,"GN","Saitama"
"Styrax shiraianus Makino",4594,"GN","Yamanashi"
"Styrax shiraianus Makino",4594,"GN","Tokyo"
"Schizophragma hydrangeoides Siebold et Zucc.",11199,"GN","Tokyo"
"Laportea bulbifera (Siebold et Zucc.) Wedd.",9810,"GN","Tokyo"
"Kerria japonica (L.) DC.",11510,"GN","Tokyo"
"Acer micranthum Sieb. et Zucc.",5384,"BU","Tokyo"
"Macleaya cordata (Willd.) R. Br.",10805,"GN","Tokyo"
"Acer rufinerve Sieb. et Zucc.",5379,"BU","Tokyo"
"Carpinus laxiflora (Siebold et Zucc.) Blume",9713,"GN","Yamanashi"
"Carpinus laxiflora (Siebold et Zucc.) Blume",9713,"GN","Tokyo"
"Artemisia japonica Thunb. subsp. japonica",165,"GN","Tokyo"
"Rhododendron semibarbatum Maxim.",4432,"GN","Saitama"
"Rhododendron semibarbatum Maxim.",4432,"GN","Tokyo"
"Picea jezoensis Carri{e`}re var. hondoensis Mayr",79,"BU","Tokyo"
"Rhus ambigua Lavall{e'}e ex Dippel",5371,"GN","Saitama"
"Rhus ambigua Lavall{e'}e ex Dippel",5371,"GN","Tokyo"
"Abies homolepis Sieb. et Zucc.",3967,"BU","Tokyo"
"Acer distylum Sieb. et Zucc.",5385,"BU","Tokyo"
"Lysimachia clethroides Duby",29844,"GN","Tokyo"
"Meliosma tenuis Maxim.",5407,"GN","Tokyo"
"Thujopsis dolabrata (L. f.) Sieb. et Zucc.",3990,"GD","Saitama"
"Thujopsis dolabrata (L. f.) Sieb. et Zucc.",3990,"GD","Yamanashi"
"Thujopsis dolabrata (L. f.) Sieb. et Zucc.",3990,"GD","Tokyo"
"Stachyurus praecox Sieb. et Zucc.",3210,"GN","Yamanashi"
"Stachyurus praecox Sieb. et Zucc.",3210,"GN","Tokyo"
"Quercus serrata Murray",9727,"GN","Tokyo"
"Quercus dentata Thunb.",9723,"GN","Tokyo"
"Lindera obtusiloba Blume",10281,"GN","Tokyo"
"Saxifraga fortunei Hook. f. var. alpina (Matsum. et Nakai) Nakai",11092,"GN","Tokyo"
"Aster glehni F. Schmidt var. hondoensis",151,"BU","Tokyo"
"Betula ermanii Cham. var. ermanii",9692,"GN","Tokyo"
"Clethra barbinervis Sieb. & Zucc.",29824,"GN","Tokyo"
"Betula corylifolia Regel et Maxim",9687,"BU","Tokyo"
"Shortia uniflora (Maxim.) Maxim.",4407,"GD","Saitama"
"Shortia uniflora (Maxim.) Maxim.",4407,"GD","Yamanashi"
"Shortia uniflora (Maxim.) Maxim.",4407,"GD","Tokyo"
"Rubus phoenicolasius Maxim.",11434,"GN","Tokyo"
"Abies mariesii Mast.",3970,"BU","Tokyo"
"Acer japonicum Thunb.",5389,"BU","Tokyo"
"Swida macrophylla (Wall.) Soj{a'}rk",5733,"GN","Yamanashi"
"Swida macrophylla (Wall.) Soj{a'}rk",5733,"GN","Tokyo"
"Polystichum tripteron (Kunze) C. Presl",3556,"GN","Tokyo"
"Oenanthe javanica (Blume) DC.",3235,"GN","Tokyo"
"Eleutherococcus innovans (Sieb. et Zucc.) H. Ohba",5745,"GN","Yamanashi"
"Eleutherococcus innovans (Sieb. et Zucc.) H. Ohba",5745,"GN","Tokyo"
"Lysimachia japonica Thunb.",4553,"GN","Tokyo"
"Albizia julibrissin Durazz.",11594,"GN","Tokyo"
"Parthenocissus tricuspidata (Sieb. et Zucc.) Planch.",5488,"GN","Tokyo"
"Chamaecyparis obtusa (Sieb. et Zucc.) Endl.",3992,"BU","Tokyo"
"Celastrus orbiculatus Thunb.",3188,"GN","Tokyo"
"Pteridium aquilinum (L.) Kuhn",3400,"GN","Tokyo"
"Parasenecio delphiniifolia (Sieb. et Zucc.) H. Koyama",4138,"GN","Tokyo"
"Akebia quinata (Houtt.) Decne.",10579,"GN","Tokyo"
"Wisteria floribunda (Willd.) DC.",11647,"BU","Tokyo"
"Chloranthus serratus (Thunb.) Roem. et Schult.",10621,"GN","Tokyo"
"Chelidonium majus L. subsp. asiaticum H. Hara",10801,"GN","Tokyo"
"Smilax sieboldii Miq.",30389,"GN","Tokyo"
"Torreya nucifera (L.) Sieb. et Zucc.",4003,"GN","Tokyo"
"Swida controversa (Hemsl. ex Prain) Soj{a'}rk",5732,"GN","Tokyo"
"Abies veitchii Lindl.",3138,"BU","Tokyo"
"Castanea crenata Siebold et Zucc.",9752,"GN","Tokyo"
"Meliosma myriantha Sieb. et Zucc.",5406,"GN","Tokyo"
"Rhus trichocarpa Miq.",5373,"GN","Tokyo"
"Acer pictum Thunb. subsp. mono Maxim.",648,"GN","Tokyo"
"Sapium japonicum (Sieb. et Zucc.) Pax et K. Hoffm.",5301,"GN","Yamanashi"
"Sapium japonicum (Sieb. et Zucc.) Pax et K. Hoffm.",5301,"GN","Tokyo"
"Ostrya japonica Sarg.",9710,"GN","Yamanashi"
"Ostrya japonica Sarg.",9710,"GN","Tokyo"
"Rhododendron keiskei Miq.",4429,"BU","Tokyo"
"Aesculus turbinata Blume",5402,"GN","Tokyo"
"Syneilesis palmata (Thunb.) Maxim.",4132,"GN","Tokyo"
"Ainsliaea apiculata Sch.-Bip.",3160,"GN","Tokyo"
"Fagus crenata Blume",9718,"BU","Tokyo"
"Callicarpa mollis Sieb. et Zucc.",4901,"GN","Yamanashi"
"Callicarpa mollis Sieb. et Zucc.",4901,"GN","Tokyo"
"Staphylea bumalda DC.",5456,"GN","Tokyo"
"Vitis coignetiae Pulliat ex Planch.",5484,"GN","Tokyo"
"Lespedeza buergeri Miq.",11745,"GN","Tokyo"
"Actinidia polygama (Siebold et Zucc.) Planch. ex Maxim.",10711,"GN","Tokyo"
"Pterocarya rhoifolia Siebold et Zucc.",9576,"GN","Tokyo"
"Styrax obassia Sieb. et Zucc.",4593,"GN","Tokyo"
"Morus australis Poir. in Lam.",9799,"GN","Tokyo"
"Pieris japonica (Thunb.) D. Don ex G. Don",4489,"BU","Tokyo"
"Geranium nepalense Sweet",11856,"GN","Tokyo"
"Acer tschonoskii Maxim.",3180,"BU","Tokyo"
"Quercus crispula Blume",9724,"GN","Tokyo"
"Acer crataegifolium Sieb. et Zucc.",5383,"BU","Tokyo"
"Prunella vulgaris L. subsp. asiatica (Nakai) Hara",473,"GN","Tokyo"
"Phellodendron amurense Rupr.",3178,"GN","Tokyo"
"Lindera praecox (Siebold et Zucc.) Blume",10282,"BU","Tokyo"
"Lonicera japonica Thunb. ex Murray",5231,"GN","Tokyo"
"Hylodesmum podocarpum (DC.) H.Ohashi et R.R.Mill var. oxyphyllum (DC.) H.Ohashi et R.R.Mill",11743,"GN","Tokyo"
"Pourthiaea villosa (Thunb.) Decne. var. viliosa",11300,"GN","Tokyo"
"Magnolia hypoleuca Siebold et Zucc.",10247,"GN","Tokyo"
"Rubia argyi (L{e'}v. et Van.) Hara ex Lauener",4839,"GN","Tokyo"
"Paraixeris denticulata (Houtt.) Nakai",4052,"GN","Yamanashi"
"Paraixeris denticulata (Houtt.) Nakai",4052,"GN","Tokyo"
"Mallotus japonicus (Thunb. ex L. f.) M{uu}ll. Arg.",5295,"GN","Yamanashi"
"Mallotus japonicus (Thunb. ex L. f.) M{uu}ll. Arg.",5295,"GN","Tokyo"
"Aria alnifolia (Siebold et Zucc.) Decne.",11297,"GN","Tokyo"
"Fraxinus sieboldiana Bl.",4625,"GN","Tokyo"
"Rhododendron obtusum (Lindl.) Planch. var. kaempferi Planch.",290,"BU","Tokyo"
"Aralia cordata Thunb.",3227,"GN","Tokyo"
"Cryptotaenia japonica Hassk.",5765,"GN","Tokyo"
"Stephanandra incisa (Thunb.) Siebold et Zucc. ex Zabel var. incisa",11254,"GN","Tokyo"
"Fagus japonica Maxim.",9719,"BU","Tokyo"
"Persicaria thunbergii (Siebold et Zucc.) H.Gross var. thunbergii",9976,"GN","Tokyo"
"Leibnitzia anandria (L.) Turcz.",4392,"GN","Tokyo"
"Vitis flexuosa Thunb.",3192,"GN","Tokyo"
"Sanicula chinensis Bunge",5760,"GN","Tokyo"
"Hydrangea involucrata Siebold var. involucrata",11206,"BU","Tokyo"
"Clematis apiifolia DC.",10437,"GN","Tokyo"
"Deutzia crenata Siebold et Zucc. var. crenata",11185,"GN","Tokyo"
"Acer nikoense Maxim.",5394,"BU","Yamanashi"
"Acer nikoense Maxim.",5394,"BU","Tokyo"
"Actinidia kolomikta (Maxim.",10712,"0.004785","Tokyo"
"Stellaria aquatica (L.) Scop.",10117,"GN","Tokyo"
"Carpinus tschonoskii Maxim.",9712,"GN","Tokyo"
"Blechnum niponicum (Kunze) Makino",3531,"GN","Tokyo"
"Picea polita (Sieb. et Zucc.) Carri{e`}re",3977,"BU","Tokyo"
"Phryma leptostachya L. var. oblongifolia Koidz.",499,"GN","Tokyo"
"Zanthoxylum piperitum (L.) DC.",5338,"GN","Tokyo"
"Plantago asiatica L.",5144,"GN","Tokyo"
"Aster scaber Thunb.",4175,"GN","Tokyo"
"Acer ukurunduense Trautv. et C. A. Mey.",5387,"GN","Tokyo"
"Picrasma quassioides (D. Don) Benn.",5354,"GN","Tokyo"
"Viburnum furcatum Bl. ex Maxim.",5214,"GN","Tokyo"
"Buddleja japonica Hemsl.",5027,"BU","Yamanashi"
"Buddleja japonica Hemsl.",5027,"BU","Tokyo"
"Eleutherococcus sciadophylloides (Franch. et Sav.) H. Ohashi",5746,"GN","Tokyo"
"Juglans mandshurica Maxim. var. sachalinensis (Miyabe et Kud{o^}) Kitam.",9579,"GN","Tokyo"
"Cephalotaxus harringtonia (Knight ex Forbes) K. Koch",4002,"GN","Yamanashi"
"Cephalotaxus harringtonia (Knight ex Forbes) K. Koch",4002,"GN","Tokyo"
"Osmunda japonica Thunb.",3329,"GN","Tokyo"
"Aria japonica Decne.",11298,"BU","Tokyo"
"Ampelopsis glandulosa (Wall.) Momiy. var. hancei",682,"GN","Tokyo"
"Adiantum pedatum L.",3447,"GN","Tokyo"
"Patrinia villosa (Thunb.) Juss.",5257,"GN","Tokyo"
"Sanguisorba officinalis L.",11499,"GN","Tokyo"
"Pinus koraiensis Sieb. et Zucc.",3984,"GN","Tokyo"
"Callicarpa japonica Thunb.",4907,"GN","Tokyo"
"Hydrangea hirta (Thunb.) Siebold",11219,"BU","Yamanashi"
"Hydrangea hirta (Thunb.) Siebold",11219,"BU","Tokyo"
"Acer argutum Maxim.",5378,"BU","Tokyo"
"Zelkova serrata (Thunb.) Makino",9762,"GN","Tokyo"
"Ilex macropoda Miq.",5429,"GN","Tokyo"
"Akebia trifoliata (Thunb.) Koidz.",10580,"GN","Tokyo"
"Picea alcoquiana (Veitch ex Lindl.) Carri{e`}re",3981,"GD","Tokyo"
"Larix kaempferi (Lamb.) Carri{e`}re",3975,"BU","Tokyo"
"Adenocaulon himalaicum Edgew.",4072,"GN","Tokyo"
"Eupatorium glehni F. Schmidt ex Trautv.",4284,"GN","Saitama"
"Eupatorium glehni F. Schmidt ex Trautv.",4284,"GN","Tokyo"
"Euptelea polyandra Sicbold et Zucc",10312,"BU","Yamanashi"
"Euptelea polyandra Sicbold et Zucc",10312,"BU","Tokyo"
"Acer carpinifolium Sieb. et Zucc.",5397,"BU","Yamanashi"
"Acer carpinifolium Sieb. et Zucc.",5397,"BU","Tokyo"
"Fallopia japonica (Houtt.) Ronse Decr. var. japonica",9949,"GN","Tokyo"
"Abies firma Sieb. et Zucc.",3968,"BU","Tokyo"
"Hylotelephium verticillatum (L.) H. Ohba var. verticillatum",10987,"GN","Tokyo"
"Hylotelephium verticillatum (L.) H. Ohba var. verticillatum",10987,"GN","Saitama"
"Thalictrum minus L. var. hypoleucum (Siebold et Zucc.) Miq.",10543,"GN","Tokyo"
"Pennisetum alopecuroides (L.) Spreng.",29565,"GN","Tokyo"
"Mimulus nepalensis Benth.",5050,"GN","Tokyo"
"Mimulus nepalensis Benth.",5050,"GN","Saitama"
"Ajuga decumbens Thunb.",4925,"GN","Tokyo"
"Rubus parvifolius L.",11435,"GN","Tokyo"
"Hylodesmum oldhamii (Oliv.) H.Ohashi et R.R.Mill",11735,"GN","Tokyo"
"Pinus densiflora Sieb. et Zucc.",3986,"GN","Tokyo"
"Orixa japonica Thunb.",5337,"GN","Tokyo"
"Quercus glauca Thunb.",9738,"GN","Tokyo"
"Pueraria lobata (Willd.) Ohwi",11792,"GN","Tokyo"
"Smilax china L.",29794,"GN","Tokyo"
"Celtis sinensis Pers.",9767,"GN","Tokyo"
"Euonymus fortunei (Turcz.) Hand.-Mazz. var. radicans Sieb. ex Miq.",662,"GN","Tokyo"
"Panax pseudoginseng Wall. var. japonicus",752,"GN","Tokyo"
"Panax pseudoginseng Wall. var. japonicus",752,"GN","Saitama"
"Euonymus alatus (Thunb.) Sieb.",3186,"GN","Tokyo"
"Nandina domestica Thunb.",10558,"GN","Tokyo"
"Ardisia japonica (Thunb.) Bl.",4535,"GN","Tokyo"
"Fraxinus mandshurica Rupr.",4623,"GN","Tokyo"
"Fraxinus mandshurica Rupr.",4623,"GN","Saitama"
"Vicia unijuga A.Braun",11620,"GN","Tokyo"
"Gleichenia japonica Spreng.",3342,"GN","Tokyo"
"Gleichenia japonica Spreng.",3342,"GN","Saitama"
"Quercus myrsinifolia Blume",9741,"GN","Tokyo"
"Zanthoxylum schinifolium Sieb. et Zucc.",5343,"GN","Tokyo"
"Aruncus dioicus (Walter) Fernaid var. kamtschaticus (Maxim.) H. Hara",11247,"GN","Tokyo"
"Hovenia dulcis Thunb.",5472,"GN","Tokyo"
"Ficus nipponica Franch. et Sav.",9777,"GN","Tokyo"
"Camellia japonica L.",10714,"GN","Tokyo"
"Dendranthema japonicum (Makino) Kitam.",4242,"BU","Tokyo"
"Buckleya lanceolata (Siebold et Zucc.) Miq.",9889,"GN","Tokyo"
"Houttuynia cordata Thunb.",10614,"GN","Tokyo"
"Quercus acutissima Carruth.",9721,"GN","Tokyo"
"Styrax japonicus Sieb. et Zucc.",4592,"GN","Tokyo"
"Rumex japonicus Houtt.",9910,"GN","Tokyo"
"Zabelia integrifolia (Koidz.) Makino ex Ikuse et Kurosawa",5230,"BU","Tokyo"
"Zabelia integrifolia (Koidz.) Makino ex Ikuse et Kurosawa",5230,"BU","Saitama"
"Boenninghausenia albiflora (Hook.) Meisn. var. japonica Nakai ex Makino et Nemoto",626,"GN","Tokyo"
"Senecio cannabifolius Less.",4119,"GN","Tokyo"
"Elaeagnus umbellata Thunb.",3200,"GN","Tokyo"
"Youngia japonica (L.) DC.",4062,"GN","Tokyo"
"Agrimonia pilosa Ledeb.",11492,"GN","Tokyo"
"Imperata cylindrica (L.) Raeusch.",29511,"GN","Tokyo"
"Gynostemma pentaphyllum (Thunb.) Makino",5635,"GN","Tokyo"
"Cocculus trilobus (Thunb.) DC.",10592,"GN","Tokyo"
"Drosera rotundifolia L.",10961,"GN","Tokyo"
"Castanopsis cuspidata (Thunb.) Schotlky",9755,"GN","Tokyo"
"Ligustrum japonicum Thunb.",4636,"GN","Tokyo"
"Eurya japonica Thunb.",10738,"GN","Tokyo"
"Viburnum phlebotrichum Sieb. et Zucc.",5215,"BU","Tokyo"
"Litsea coreana H.Lev.",10295,"GN","Saitama"
"Litsea coreana H.Lev.",10295,"GN","Tokyo"
"Vaccinium japonicum Miq.",4498,"GN","Saitama"
"Vaccinium japonicum Miq.",4498,"GN","Tokyo"
"Elaeagnus glabra Thunb.",5554,"GN","Tokyo"
"Mitchella undulata Sieb. et Zucc.",4830,"GN","Saitama"
"Ilex integra Thunb.",5415,"GN","Saitama"
"Magnolia kobus DC.",10251,"GN","Chiba"
"Rubia argyi (L{e'}v. et Van.) Hara ex Lauener",4839,"GN","Chiba"
"Indigofera pseudotinctoria Matsum.",11687,"GN","Chiba"
"Styrax japonicus Sieb. et Zucc.",4592,"GN","Chiba"
"Zanthoxylum schinifolium Sieb. et Zucc.",5343,"GN","Chiba"
"Hylodesmum oldhamii (Oliv.) H.Ohashi et R.R.Mill",11735,"GN","Chiba"
"Agrimonia pilosa Ledeb.",11492,"GN","Chiba"
"Lobelia chinensis Lour.",5208,"GN","Chiba"
"Centella asiatica (L.) Urb.",5759,"GN","Saitama"
"Centella asiatica (L.) Urb.",5759,"GN","Chiba"
"Juglans mandshurica Maxim. var. sachalinensis (Miyabe et Kud{o^}) Kitam.",9579,"GN","Chiba"
"Cryptotaenia japonica Hassk.",5765,"GN","Chiba"
"Cladium mariscus subsp. mariscus",21441,"GN","Saitama"
"Cladium mariscus subsp. mariscus",21441,"GN","Chiba"
"Rubus microphyllus L.f.",11420,"GN","Chiba"
"Pteridium aquilinum (L.) Kuhn",3400,"GN","Chiba"
"Ilex integra Thunb.",5415,"GN","Chiba"
"Sanguisorba officinalis L.",11499,"GN","Chiba"
"Chloranthus japonicus Siebold",10620,"GN","Chiba"
"Albizia julibrissin Durazz.",11594,"GN","Chiba"
"Silene miqueliana (Rohrb.) H.Ohashi et H.Nakai",10151,"BU","Saitama"
"Silene miqueliana (Rohrb.) H.Ohashi et H.Nakai",10151,"BU","Chiba"
"Leibnitzia anandria (L.) Turcz.",4392,"GN","Chiba"
"Fatsia japonica (Thunb.) Decne. et Planch.",3228,"GN","Saitama"
"Fatsia japonica (Thunb.) Decne. et Planch.",3228,"GN","Chiba"
"Vitis ficifolia Bunge var. lobata Regel",675,"GN","Chiba"
"Castanopsis cuspidata (Thunb.) Schotlky",9755,"GN","Chiba"
"Fallopia japonica (Houtt.) Ronse Decr. var. japonica",9949,"GN","Chiba"
"Lysimachia japonica Thunb.",4553,"GN","Chiba"
"Ligustrum japonicum Thunb.",4636,"GN","Chiba"
"Alnus japonica (Thunb.) Steud.",9676,"GN","Chiba"
"Quercus dentata Thunb.",9723,"GN","Chiba"
"Parthenocissus tricuspidata (Sieb. et Zucc.) Planch.",5488,"GN","Chiba"
"Zanthoxylum piperitum (L.) DC.",5338,"GN","Chiba"
"Carpinus laxiflora (Siebold et Zucc.) Blume",9713,"GN","Chiba"
"Geranium nepalense Sweet",11856,"GN","Chiba"
"Youngia japonica (L.) DC.",4062,"GN","Chiba"
"Prunella vulgaris L. subsp. asiatica (Nakai) Hara",473,"GN","Chiba"
"Aster scaber Thunb.",4175,"GN","Chiba"
"Salix integra Thunb.",9613,"GN","Chiba"
"Osmunda japonica Thunb.",3329,"GN","Chiba"
"Akebia trifoliata (Thunb.) Koidz.",10580,"GN","Chiba"
"Houttuynia cordata Thunb.",10614,"GN","Chiba"
"Aralia cordata Thunb.",3227,"GN","Chiba"
"Lindera praecox (Siebold et Zucc.) Blume",10282,"BU","Chiba"
"Macleaya cordata (Willd.) R. Br.",10805,"GN","Chiba"
"Callicarpa japonica Thunb.",4907,"GN","Chiba"
"Rumex japonicus Houtt.",9910,"GN","Chiba"
"Haloragis micrantha (Thunb.) R. Br. ex Sieb. et Zucc.",5723,"GN","Saitama"
"Haloragis micrantha (Thunb.) R. Br. ex Sieb. et Zucc.",5723,"GN","Chiba"
"Oenanthe javanica (Blume) DC.",3235,"GN","Chiba"
